[
  {
    "session_id": "session-codex-fixture-0001",
    "agent": "codex",
    "cwd": "/workspace/demo",
    "modified_at": null,
    "file_path": "session-codex-fixture-0001.jsonl"
  },
  {
    "session_id": "session-codex-malformed",
    "agent": "codex",
    "cwd": "/workspace/demo",
    "modified_at": null,
    "file_path": "session-codex-malformed.jsonl"
  },
  {
    "session_id": "session-codex-mixed-schema",
    "agent": "codex",
    "cwd": "/workspace/demo",
    "modified_at": null,
    "file_path": "session-codex-mixed-schema.jsonl"
  },
  {
    "session_id": "session-codex-multi",
    "agent": "codex",
    "cwd": "/workspace/demo",
    "modified_at": null,
    "file_path": "session-codex-multi.jsonl"
  },
  {
    "session_id": "session-codex-tool-fixture",
    "agent": "codex",
    "cwd": "/workspace/demo",
    "modified_at": null,
    "file_path": "session-codex-tool-fixture.jsonl"
  }
]
